timestamp,person,role,content,ai_reasoning
2026-04-17 14:29:40,system,mode,Mode: Coach,
2026-04-17 14:29:40,coach_a,side_panel,I don't have any quotes from Person B as this conversation has just begun and no messages have been shared.,"I was instructed to respond based on Person A's side of the conversation, but since this conversation just started, there's no information about Person A or Person B's statements. I noticed that the conversation is empty, and I should acknowledge this before providing any response. I will politely point out the lack of information and wait for further context."
2026-04-17 14:29:49,Person A,user,Coffee is better than tea,
2026-04-17 14:29:50,coach_a,auto_response,"That's an interesting claim, what makes you think coffee is better than tea, is it the taste or some other factor?","Triggered by: low word count, logical_fallacy. I noticed that Person A made a statement comparing coffee and tea, and I chose to respond by engaging with this statement to encourage further discussion. Since I don't have any context about the opposing argument, I will focus on Person A's claim."
2026-04-17 14:29:54,Person B,user,Tea is better than coffee.,
2026-04-17 14:29:55,coach_b,auto_response,"That's an interesting claim, what makes you think tea is better than coffee, is it the taste or some other aspect?","Triggered by: low word count, logical_fallacy. I noticed that Person B made a bold statement comparing tea and coffee, which could be the starting point for a debate, and I chose to respond in a way that encourages them to elaborate on their claim. Since I don't have any opposing argument to address, I can simply build on their statement. I will provide a response that acknowledges their preference and invites further discussion."
2026-04-17 14:30:03,coach_a,side_panel,I don't have any quotes from Person B as I've only seen your side of the conversation so far.,"Since I've only seen Person A's side of the conversation, I don't have any information about Person B's statements, making it impossible to quote them. I can only respond based on Person A's claims. I will ask for clarification if needed to help Person A strengthen their argument."
2026-04-17 14:30:17,Person A,user,Coffee is better because of its acidity and aroma.,
2026-04-17 14:30:26,coach_a,side_panel,"You've highlighted some key characteristics of coffee that many people enjoy, now you might want to consider how these aspects compare to the smoothness and calming effects often associated with tea.","I noticed that Person A has made a claim about coffee being better than tea due to its acidity and aroma, and now they're asking for help, which suggests they may be looking for ways to support or expand on their argument. I will provide a response that acknowledges their point and offers a potential direction for further development."
